{
  "$schema": "https://raw.githubusercontent.com/caty-ai/family-os/main/docs/repo-state/status.schema.json",
  "schema_version": 1,
  "generator_version": "repo-state-gen v1",
  "repo": "caty-ai/family-os",
  "stamp_mode": "auto",
  "generated_at": "2026-09-18T06:55:41Z",
  "describes_commit": "c40a3429a1a12f685d9502f8db4bf04a299cc1c0",
  "describes_commit_date": "2026-09-18T06:55:41Z",
  "branch": "main",
  "latest_tag": "v0.23.0",
  "latest_release_url": "https://github.com/caty-ai/family-os/releases/tag/v0.23.0",
  "agents_entry": "FOR-AGENTS.md",
  "canonical_api": "https://api.github.com/repos/caty-ai/family-os/commits/main",
  "canonical_raw": "https://raw.githubusercontent.com/caty-ai/family-os/c40a3429a1a12f685d9502f8db4bf04a299cc1c0/status.json",
  "freshness_contract": "SHA comparison only; dates may only ever trigger distrust. Protocol: docs/repo-state/spec.md, section 'Reader protocol'."
}
